Title,Slug,Deal Count,About,QA
South Florida Properties,south-florida-properties,8,"Transwestern's South Florida commercial real estate team provides a full range of services to commercial real estate owners, users, and investors, including Agency Leasing, Asset Services, Tenant Advisory, Capital Markets, and Research. With expertise spanning office, industrial, retail, multifamily, and healthcare property types, their creative and collaborative approach positions them as a leading commercial real estate firm in South Florida.",TRUE
Diversified Realty LI,diversified-realty-li,8,"Diversified Realty LI is a commercial real estate brokerage firm specializing in the Long Island market. The company is known for arranging significant transactions, including a $4.6 million sale and multiple leases in Westbury, NY. The firm is led by Tommy Tsiolis, who has extensive experience in the local market.",TRUE
M2 CRE,m2-cre,8,"M2 CRE is a commercial real estate company established to help landlords achieve the highest and best use of their properties and growing businesses to secure a location that's just right. The company represents both the sell-side and buy-side in separate transactions, prioritizing client satisfaction and confidentiality. With a specialized approach, M2 CRE covers a large geographical area, including the entirety of North Brooklyn, and is known for its expertise in marketing, market research, negotiations, and team-oriented execution of highly sensitive transactions.",TRUE
Titan Commercial,titan-commercial,8,"Titan Commercial is a leading full-service commercial real estate firm specializing in land and industrial transactions. Established in 2022 and based in Houston, it proudly serves clients across the entire state of Texas.",TRUE
SRE Commercial Group,sre-commercial-group,8,"SRE Commercial Group is a real estate brokerage focused on procuring commercial real estate opportunities for clients. The company takes an old-school approach to selling real estate by establishing positive relationships with sellers and buyers, aiming to achieve the best price in the quickest time. The team consists of experienced real estate agents who specialize in industrial, office, and retail properties. They have successfully closed nearly $400,000,000 in sales and provide comprehensive services including property valuation, buyer procurement, and leasing representation.",TRUE
MHP Real Estate Services,mhp-real-estate-services,8,"MHP Real Estate Services is a full-service commercial real estate company founded in 1971. It operates in the heart of Manhattan and has evolved from a boutique owner/manager of commercial properties. The company is engaged in commercial real estate acquisition, leasing, and management. It has divisions including brokerage, acquisition/disposition, asset management, and project management. MHP has bought and sold over 150 properties valued at more than $12 billion.",TRUE
Bandon Capital Advisors,bandon-capital-advisors,8,"Bandon Capital Advisors is a leading commercial mortgage banking and capital advisory firm with more than 125 years of combined expertise. The company specializes in providing strategic capital solutions to achieve long-term goals. They have completed over $5 billion in historical transactional activity and have originated over 1,000 loans. The firm is relationship-driven, focusing on delivering creative capital solutions that align with clients' objectives.",TRUE
Welco Realty,welco-realty,8,"Welco Realty, Inc. was established over 30 years ago and has become one of the Premier Retail Real Estate Experts in the Northeast. The company specializes in retail tenant representation, shopping center, mall, and CBD retail leasing primarily focused in the metropolitan New York, New Jersey, Connecticut & Pennsylvania markets. Welco Realty represents and has represented notable national and retail chains, including JCPenney, AMC Theatres, Pier 1 Imports, Federated Department Stores, TJX Companies, Toys R Us, Party City, Fairway Markets, Dress Barn, HSBC Bank, Modell‚Äôs Sporting Goods, Jo-Ann Fabric & Crafts, among others. The company's objective is to provide high-quality professional real estate consulting and brokerage services tailored to its clients' needs. Welco works closely with its retail clients to help develop their store expansion strategy, which encompasses market analysis, site selection, demographics, competition evaluation, and lease negotiations. The company has a successful track record, leasing millions of square feet of shopping center and CBD retail space throughout various New York, New Jersey, Connecticut, and Pennsylvania markets. Welco Realty does not engage in the sale or lease of residential property; it is strictly a commercial real estate firm.",TRUE
Maverick Commercial Mortgage,maverick-commercial-mortgage,8,"Maverick Commercial Mortgage is a Chicago-based commercial and multi-family mortgage banking firm. It specializes in funding mortgage loans for various property types, ranging from $2 to $100 million. The company has over 40 years of experience in commercial and multi-family real estate financing. They offer a broad range of loan types, including short-term and permanent loans, and provide exceptional client service to guide clients through complex processes. The firm has experience across every commercial real estate type, including retail, office, multi-family, manufactured housing communities, industrial, hotel, and others.",TRUE
Freudenheim Partners,freudenheim-partners,8,"Freudenheim Partners is a commercial real estate brokerage firm founded on the principle that effective solutions for our clients build lasting partnerships. The company brings creativity, thoughtful insight, and superior execution to each leasing and investment sales interaction. With an emphasis on attention to detail and a hands-on approach, Freudenheim Partners prioritizes its clients' needs. The firm is based in Boston and serves the downtown and suburban markets of greater Boston, focusing on transactions involving land, industrial, office, and retail properties.",TRUE
Disney Investment Group,disney-investment-group,8,"Disney Investment Group is a commercial real estate advisory firm specializing in selling shopping centers and retail properties of all types and sizes. The company has executed over $2.28 billion in shopping center transactions and focuses on sell-side execution of core and value-add retail properties in Texas and the southwest United States. They also source off-market transactions nationwide, primarily selling assets in the $5 million to $100+ million range, with a sweet spot in the $10 million to $50 million range. The firm consistently drives pricing to the highest levels attainable for clients and emphasizes exceptional service and execution.",TRUE
Lument,lument,8,"{'name': 'Lument', 'parent_company': 'ORIX Corporation USA', 'description': 'Lument is a national leader in commercial real estate finance, delivering a comprehensive set of capital solutions customized for investors in multifamily, affordable housing, and seniors housing and healthcare real estate.', 'services': ['Commercial real estate financing', 'Proprietary commercial lending', 'Real estate investment sales', 'Real estate capital markets', 'Investment banking', 'Investment management'], 'lending_capabilities': ['Fannie Mae DUS¬Æ', 'Freddie Mac Optigo¬Æ', 'FHA', 'USDA'], 'employees': 'Approximately 600 employees', 'offices': 'Over 30 offices across the United States', 'securities_services': 'Provided through Lument Securities, LLC, Member FINRA/SIPC'}",TRUE
Cameron Real Estate Group,cameron-real-estate-group,8,"Cameron Real Estate Group is a real estate brokerage based in Wakefield, Massachusetts. The company offers various real estate services, including residential property listings, commercial property listings, and agent training. They are known for their supportive environment for new agents, providing training, leadership, mentorship, leads, and overall assistance. The company operates primarily in the New England region and is affiliated with multiple listing services (MLS) in the area.",TRUE
MIG Commercial Real Estate Services,mig-commercial-real-estate-services,8,"MIG Commercial Real Estate Services is a licensed real estate broker in the State of California, DRE Lic. #02211621. The company specializes in the sales and leasing of commercial and industrial properties in Los Angeles County. They offer commercial property consultations, 1031 exchanges, estate sales, and other complex transactions. Their services include direct outreach, database leverage, and local door-knocking campaigns to maximize exposure and find the right audience for each property. The company is known for its individualized service, extensive local expertise, and customized marketing strategies to help clients realize the maximum value for their properties.",TRUE
Floridian First Realty,floridian-first-realty,8,"Floridian First Realty is a real estate firm specializing in residential, commercial, and luxury properties in Miami and throughout Florida. The company emphasizes personalized service and innovative solutions tailored to clients' unique needs. Their team includes highly specialized agents who provide comprehensive market analysis and investment strategies to maximize returns. The firm is known for its exceptional customer service and commitment to excellence in real estate transactions.",TRUE
Dags Group & Associates,dags-group-associates,8,"Dags Group & Associates is a commercial real estate company specializing in the sales and leasing of retail, office, industrial, and multifamily assets. The company is based in South Florida and provides investment solutions for buyers and sellers, as well as landlord and tenant representation. The company can be contacted at 786-301-3296 or through their website at https://www.dagsgroup.com.",TRUE
Prescott Advisory,prescott-advisory,8,"Prescott Advisory is a commercial real estate company that provides services such as buying, selling, and leasing commercial properties. The company offers personalized guidance and expert advice tailored to the unique needs of each client. They have extensive knowledge of the Prescott market, ensuring clients get the best deals and opportunities. The team focuses on transparency and integrity, providing honest communication and clear processes to help clients make informed decisions. Prescott Advisory also offers complimentary quotes and consultations, allowing clients to explore their options without pressure or commitment.",TRUE
Madison Residential Realty,madison-residential-realty,8,"Madison Residential is a full-service real estate company dedicated to helping clients with all their real estate needs. The company offers a comprehensive approach to buying and selling homes in Beverly Hills, West Los Angeles, and coastal communities. It provides advanced search options, map search, and property request services. The team is experienced in local markets and committed to excellence in real estate transactions.",TRUE
EP Realty Group,ep-realty-group,8,"EP Realty Group, Inc is a commercial real estate brokerage specializing in South Florida, led by Estrella Perez, a top leading real estate broker with over $500 million in closed sales.",TRUE
Resource Realty,resource-realty,8,"Resource Realty is a commercial real estate company founded in 1989 by a group of veteran commercial real estate professionals. The company provides customized corporate real estate solutions, including sales and leasing, representation services, corporate solutions, investment sales and acquisition, and cost segregation. Resource Realty offers financial services such as loan sourcing and bank relationship management. The company operates in multiple locations in New Jersey and Pennsylvania, with offices in Parsippany, Woodbridge, and Moorestown, and provides professional brokerage solutions to meet clients' needs efficiently and effectively.",TRUE
Captivate Real Estate Group,captivate-real-estate-group,8,"Captivate Real Estate Group is a digital resource for buying and selling homes in the Chicago, IL area. The company, affiliated with eXp Realty LLC, prides itself on providing top-quality service by staying ahead of the curve in finding clients opportunities both on and off the market. The team has sold over $100 million in volume and focuses on innovative marketing strategies to cater to the needs of both sellers and buyers in the Greater Chicago area.",TRUE
Markowitz Commercial Real Estate,markowitz-commercial-real-estate,8,"Markowitz Commercial Real Estate Inc. offers exclusive representation in the acquisition, disposition, and lease-up of commercial properties in Southern California.",TRUE
DSH Hotel Advisors,dsh-hotel-advisors,7,"DSH Hotel Advisors provides superior hotel brokerage and advisory services to independent and institutional hotel owners throughout the United States, with a regional focus in the Southeast. The company aims to ensure that all hotel owners have a clear understanding of how their properties are positioned in the market, their current equity level, changing dynamics that affect value and operations, and the options available to improve their position. DSH Hotel Advisors is led by Dennis S. Hopper, CCIM, who has extensive experience in hotel dispositions and has analyzed and advised on over $2.5 billion worth of hotel assets nationally. The firm specializes in exclusive and confidential hotel listings, generating multiple offers from qualified buyers to maximize value for clients. They maintain deep market knowledge through direct contact with hotel owners, buyers, sellers, lenders, franchisors, and other industry contacts.",TRUE
Chang Investment Group,chang-investment-group,7,"Chang Investment Group focuses on Commercial Real Estate advisory services primarily in Southern California. With 20 combined years of solution-driven experience, the team provides personalized care and attention. The company is known for its client-focused approach, relationship-driven services, and commitment to sustainability. Strategic partnerships with nationwide brokerages enable effective high-level negotiations. Key team members include Steve Chang, Ricardo Beristain, Lorena Hernandez, and Noel De Los Santos.",TRUE
Shatz Capital,shatz-capital,7,"Shatz Capital is a Miami-based boutique private equity & debt advisory firm specializing in commercial real estate investment and capital advisory services. Founded in 2023, the company has successfully completed over 100 transactions totaling $7 billion in debt and equity transactions.",TRUE
Vesta Preferred Realty,vesta-preferred-realty,7,"Vesta Preferred Realty is a full-service real estate agency based in Chicago, Illinois. Founded in 2009, it is ranked as the #1 independent real estate team in Illinois by volume since 2021 and has been a top-producing brokerage in the city since 2016. The company provides a range of services including buying, selling, and investing in properties across the U.S. It is known for its tight-knit agency comprised of dedicated real estate experts who have assisted thousands of satisfied clients.",TRUE
Boyne Realty,boyne-realty,7,"Boyne Realty is a real estate agency specializing in residential properties in Northern Michigan. The company offers expertise in finding properties that cater to outdoor enthusiasts, including ski/snowboard slopes, championship golf courses, and other area activities. Their agents are avid skiers, snowboarders, golfers, bikers, and hikers, providing a unique understanding of the local real estate market.",TRUE
360 Realty,360-realty,7,"360 Commercial Real Estate is a 100% woman-owned, veteran-owned business founded by Janine Punzel in March of 2014. Janine‚Äôs goal is to leverage her large-company experience in all aspects of real estate while offering clients a small-company level of personalized service.",TRUE
Press|Cuozzo,press-cuozzo,7,"Press|Cuozzo Realtors is a commercial real estate company based in Hamden, Connecticut, serving the greater New Haven area. With over 100 years of combined experience, the company provides a range of real estate services including the sale and leasing of commercial and industrial properties, buyer/tenant representation, 1031 exchanges, investment property sales, market analysis, and site selection. The company has 35 full-time associates and is known for its innovative and aggressive approach to marketing properties in response to evolving market conditions.",TRUE
Singleton Galmann Realty,singleton-galmann-realty,7,"Singleton-Galmann Realty is a real estate company established in 1985 by Maureen Singleton, Alice Galmann, and Mark Singleton. The company specializes in the sale of one, two, and three family homes and condominiums in Hoboken, NJ. They pride themselves on their dedication to personal service and commitment to providing high-level service to sellers, buyers, landlords, and tenants.",TRUE
L&L Holding Company,l-l-holding-company,7,"L&L Holding Company is a privately-owned real estate investment and development company founded in June 2000 by David Levinson and Robert Lapidus. The company specializes in identifying, acquiring, and repositioning underperforming properties in prime locations to unlock their full potential. With over 50 years of combined experience, L&L Holding Company has a portfolio of over 7 million square feet, including notable properties like 195 Broadway, 222 Broadway, and 425 Park Avenue. The company is known for its vertically-integrated platform, which enables expertise in all phases of design, development, and leasing. L&L Holding Company has received numerous industry awards for its commitment to excellence and sustainability, including LEED Gold Certification and WELL Certification.",TRUE
Gindi Realty Advisors,gindi-realty-advisors,7,"Gindi Realty Advisors is a boutique brokerage and advisory firm specializing in the discreet sale of high-value, off-market properties in Manhattan. The firm serves a select clientele including real estate investment funds, REITs, insurance companies, banks, and prominent family offices. It excels in identifying off-market properties that align with clients' stringent investment criteria, utilizing advanced analytics and comprehensive market intelligence. The firm acts as trusted advisors integral to clients' investment strategies, ensuring direct principal-to-principal engagements and facilitating transparent and efficient negotiations. Each transaction is managed with utmost attention to detail and professionalism, ensuring a smooth and efficient process from initial search to final acquisition. The team offers expert guidance and unwavering support, particularly excelling in securing and negotiating off-market deals. With a profound understanding of the Manhattan real estate market and access to a distinguished network and resources, Gindi Realty Advisors is committed to delivering exceptional service and results, meticulously tailored to meet the unique needs and aspirations of each client.",TRUE
Sterling One Realty,sterling-one-realty,7,"Sterling One Realty, Inc. is a full-service real estate company founded by William and Betsy Alvarez in 1993. It specializes in residential and commercial real estate services. The company has expanded to include 20 Sales Associates and 2 Managing Brokers. Its primary office is located in the Miami Roads/Brickell Area, with a satellite office in Miami Beach. Sterling One Realty provides a comprehensive suite of services including buyer and seller representation, market analysis, leasing, short sales, property management, broker price opinions, and REO foreclosure sales. The commercial division assists investors in development projects, multi-family properties, development rights, vacant land, and business ventures. The company has successfully developed its own condominium projects and home sites, demonstrating its ability to execute projects on time and within budget.",TRUE
Kava Realty Group,kava-realty-group,7,"Kava Realty Group, Inc. is a real estate firm in Boston, Massachusetts, founded in 2006. The company serves the city and surrounding areas, providing real estate services and listings. The data relating to real estate for sale on their website comes in part from the Internet Data Exchange/Broker Reciprocity Program of Property Information Network, Inc.",TRUE
HighStreet Net Lease Group,highstreet-net-lease-group,7,"HighStreet Net Lease Group specializes in the disposition and acquisition of net leased investment properties throughout the United States. The company provides a highly unique and customized approach with each project, utilizing a proprietary and strategic national marketing platform for maximum timely market exposure. They offer detailed product and market knowledge, along with a relationship-focused and performance-driven objective. The firm excels in net lease investment brokerage by creating a custom client-driven approach, providing diversified product inventory, and accessing aggressive investor pools. HighStreet Net Lease Group also assists clients in achieving their investment goals through the 1031 exchange process, guiding them from initial disposition to successful closing on replacement properties. The company has strong relationships with institutional investors, developers, principals, brokers, and lenders, which are invaluable tools for their clients.",TRUE
Capital Group Realty,capital-group-realty,7,"Capital Realty Group, Inc. is a leading private equity real estate group focusing on the preservation, acquisition, redevelopment, and management of affordable housing communities across the United States. The company was founded in 1999 and is based in Spring Valley, New York. It has been involved in the acquisition, redevelopment, and operation of nearly 8,000 affordable housing units in 22 states. The company's expertise includes sound financial analysis, comprehensive asset management, and a deep understanding of regulatory requirements. Capital Realty Group has a proven track record in closing complex transactions and ensuring the affordability and quality of multifamily housing for residents.",TRUE
Ecclesiastical Realty,ecclesiastical-realty,7,"Ecclesiastical Realty LLC is a boutique commercial real estate brokerage firm with over 50 years of collective experience in real estate. The company, led by Managing Partner Steve Bodden, specializes in investment sales and advisory services for religious institutions through its affiliate, Ecclesiastical Realty Advisory Services (ERAS). The firm has conducted over 300 transactions in the New York and Northern New Jersey market, totaling over two million square feet of space with an aggregate sales value exceeding $200 million. The company is based in New York and serves clients across various property types including industrial, land, office, retail, and multi-family properties.",TRUE
Undisclosed Institutional Investor,undisclosed-institutional-investor,7,"An undisclosed institutional investor is a type of investor that does not reveal their identity. These investors typically engage in large-scale commercial real estate transactions, often focusing on high-quality, institutional-grade properties such as Class A office buildings, industrial facilities, and other high-end assets. They may invest through joint ventures or partnerships with other entities, and their investments are often driven by a desire to generate significant returns through leverage and strategic asset management.",TRUE
AFS Living,afs-living,7,"AFS Living is a real estate company based in Miami, Florida. It offers MLS listings for properties for sale and rent, as well as new developments with floor plans. The company can be contacted at 2063 Biscayne Blvd, Suite #101, Miami, FL 33137, or via phone at 305-912-7112, and email at info@afsliving.com.",FALSE
Brand Urban,brand-urban,7,"Brand Urban is a commercial real estate advisory and brokerage company specializing in food and beverage, lifestyle, and service retail in major metro markets nationwide. The company provides tenant advisory services, including site selection, deal negotiation, and real estate growth strategy development. They also offer landlord advisory services, such as strategic anchor leasing, high-value partnerships, and community engagement through placemaking. Brand Urban is known for its holistic approach, leveraging deep understanding of brands, their businesses, and their core customers to develop tailored real estate strategies.",TRUE
Capital Realty Group,capital-realty-group,7,"Capital Realty Group is a full service boutique realty company providing comprehensive real estate and property management services throughout San Mateo County. The company has been working in real estate markets since 1987 and managing properties since 1989. It offers dedicated, hands-on service covering all corners of real estate, including residential, commercial, brokerage, and management. The satisfaction of clients is their top priority, and they strive to work tirelessly on behalf of their clients to help them achieve all of their real estate goals.",TRUE
