Title,Slug,Deal Count,About,QA
Reavis Partners,reavis-partners,11,"Reavis Partners is a real estate company based in Brooklyn, New York. It operates primarily in the residential real estate market, with a focus on buying and selling homes. The company is known for its expertise and innovative marketing strategies, including a dedicated media team and proprietary technology. Reavis Partners has a track record of over $20 billion in sales and more than $10 billion in new development sales, making it a prominent player in the industry. The company offers exclusive fully furnished rental packages through its Luxe Staging service, aiming to elevate the leasing experience with luxury and sophistication.",TRUE
Top Nest Properties,top-nest-properties,11,"Top Nest Properties is a full-service real estate firm headquartered in Brooklyn, led by a team of industry experts. The company is known for its exceptional agents, innovative technology, and impressive sales record. It prides itself on ethics and values shared throughout the firm, offering individualized services and delivering exceptional results. The company has a proven track record in real estate experience, support, and success, making it a trusted name for buyers, sellers, and investors alike.",TRUE
K2 Realty,k2-realty,11,"K2 Realty, Inc. is a real estate company based in Sugar Land, Texas. Founded in 2003 by James Kenny and Paul Kaneb, it specializes in exclusive real estate services. The company is known for its local expertise and community-driven approach. K2 Realty offers services including buying, selling, and leasing of residential and commercial properties, as well as assistance with short sales and foreclosure prevention. The company operates under the philosophy of 'Our Community, Our Strength,' emphasizing its commitment to the local community and clients.",TRUE
JBM Institutional Multifamily Advisors,jbm-institutional-multifamily-advisors,11,"JBM Institutional Multifamily Advisors is a boutique brokerage firm specializing in multifamily asset disposition services, equity placement, capitalization, and recapitalization of new merchant developments and existing multifamily portfolios. The company focuses exclusively on high-rise, mid-rise, garden, and BTR/SFR style apartment communities throughout Florida. With extensive relationships and $19.4+ billion in multifamily transactions, JBM provides streamlined disposition services that maximize sales proceeds, control, and transparency. The firm is known for its market dominance in Southwest Florida and has been ranked as the #1 boutique brokerage firm in the U.S. and the #1 broker in Southwest Florida. JBM has offices in Naples, St. Petersburg, and Orlando, Florida.",TRUE
Basis Industrial,basis-industrial,11,"Basis Industrial is a privately held and vertically integrated real estate owner and operator based in Boca Raton, Florida. The company was formed by industry veterans and sponsors Daniel Weinstein, Jay Massirman, and Jay Stephen Garchik. It has over 100 years of combined real estate development and management experience. Basis Industrial focuses on under-managed niche real estate asset classes, including self-storage and multi-tenant industrial warehousing throughout the US. The company currently owns over 5 million square feet of self-storage and industrial real estate and is active in various markets nationwide. Its property management arm is BaySpace.",TRUE
Telos Group,telos-group,10,"The Telos Group LLC is a Chicago-based real estate services firm specializing in the re-imagining, marketing, and leasing of commercial office properties. The company provides leasing, marketing, and consulting services in Chicago and consulting services for real estate businesses nationwide. Telos employs a disciplined and goal-driven process to create entrepreneurial solutions customized for each assignment. As Chicago's only dedicated owner representation firm, it has been the leader in shaping the evolution of office space for innovative businesses. The firm represents a portfolio of over 23 million square feet encompassing historic to trophy buildings owned by diverse ownership groups, from entrepreneurial investor consortiums to international institutions. The Telos Group was awarded Office Property Representative of the Year from 2012 through 2015 as well as 2017 by the Chicago Commercial Real Estate Awards.",TRUE
NCO Realty Group,nco-realty-group,10,"NCO Realty Group is a small real estate company based in Boston, MA. The company focuses on providing personalized services to both sellers and buyers. It is owned by Nelson Otuechere, who has over a decade of experience in residential leasing and sales. The team includes licensed sales agents such as Charlotte Hilton, Anthony Bolt, Alexa Holmes, and Dexter Forrester, as well as an operations manager, Britney Francois. The company emphasizes authenticity, integrity, and excellence in its dealings with clients, colleagues, and partners.",TRUE
WD Capital Group,wd-capital-group,10,"WD Capital Group is a commercial real estate company that focuses on exploring recent transactions, learning about the players involved, and networking opportunities. It provides insights into commercial real estate activities and facilitates connections within the industry.",TRUE
BankUnited,bankunited,10,"BankUnited is a commercial bank that offers a variety of financial solutions for businesses, including commercial lending, real estate financing, and treasury services. The bank provides tailored commercial banking solutions, capital financing options, and specialized services such as lines of credit, term loans, and commercial card programs. BankUnited also has a dedicated team for commercial real estate lending and has promoted executives to oversee this business in Florida. The bank is committed to providing personalized service and supporting businesses with customized solutions to help them grow and prosper.",TRUE
The Collective Realty,the-collective-realty,10,"The Collective Realty is a boutique real estate firm based in Los Angeles. Founded by Anthony Vulin, the company focuses on exceeding client expectations through experienced and knowledgeable agents. The firm operates in the Greater Los Angeles Area, specializing in residential and commercial properties. Anthony Vulin has a significant background in real estate, having started his career after graduating from UCLA in 2000. He has managed and built successful teams at Keller Williams, including the Los Feliz office, which he transformed from #5 to #1 in local market share. The Collective Realty is known for its rigorous agent selection process, hiring only 10% of interviewed agents. The company is also recognized for its international marketing capabilities, marketing properties to over 50 International MLSs. Anthony Vulin is a Director for the California Association of Realtors, Past President of the Greater LA Association of Realtors, and National Vice President of the LGBTQ Real Estate Alliance.",TRUE
Mocca Realty,mocca-realty,10,"Mocca Realty is a real estate company based in Miami, Florida. It is associated with Mocca Group, which specializes in luxury real estate, construction, and hospitality. The company is known for its expertise in exclusive listings and personalized services. It is led by Alex Pirez, who has over 20 years of experience in the industry. Mocca Realty is involved in high-end real estate deals, including the sale of a non-waterfront spec mansion for $21 million in Coral Gables.",TRUE
Kole Group,kole-group,10,"Kole Group is a real estate company dedicated to maximizing real estate asset value. The company provides services for commercial use and offers guidance for rentals, buyers, and sellers. It has offices in various locations including Long Island, Queens, Lower Hudson Valley, Manhattan, Bronx, and Brooklyn. The company can be contacted at 917.485.5519 or via email at ak@kole.group.",TRUE
Curated Real Estate Capital,curated-real-estate-capital,10,"Curated Real Estate Capital is a company that operates in the Finance industry, headquartered in Miami, Florida. It specializes in delivering bespoke financing solutions tailored to each client's specific needs, ensuring execution with certainty and speed. The company has experience in various real estate transactions, including single-family home subdivisions, multifamily apartments, and built-to-rent homes. It is led by partners such as Cameron Huard, Will Macfee, Luca Zaharias, Albert Malik, AJ Miele, Jabari Quigley, and CJ Molino.",TRUE
Smith Commercial Property Group,smith-commercial-property-group,10,"Smith-CRE is a real estate investment, development, and management firm headquartered in Miami, Florida. The company specializes in commercial real estate, offering services in leasing, sales, and property management. Their strategy involves analyzing client goals, setting action plans, and taking proactive steps to find suitable tenants and investments. They manage real estate fund investments on behalf of their clients and provide stress-free property management services, handling day-to-day operations and financial management tailored to individual needs.",TRUE
JSN Properties,jsn-properties,10,"JSN Properties is a real estate company based in Bell, FL, and New York, NY. Founded by Jeffrey Nissani, the company offers a range of real estate services including renewals, consulting, tenant representation, and property sales. It represents and manages various properties through its listings.",TRUE
Smart Luxe Realty,smart-luxe-realty,10,"Smart Luxe Realty is a real estate company specializing in luxury condo deals in South Florida. It utilizes artificial intelligence (AI) powered algorithms to find the best luxury condo deals. The company provides comprehensive services including searching MLS for active properties, viewing new developments with floor plans, and accessing listings with photos. Smart Luxe Realty aims to help clients maximize their rental capacity through various short and long-term rental options.",TRUE
LH Capital Partners,lh-capital-partners,10,"LH Capital Partners is a private equity company based in San Francisco, United States, with less than $150 million in assets under management. It focuses on investments in various sectors, including commercial real estate, but specific details about its commercial real estate activities are not provided in the available sources.",TRUE
Linda R. Olsson,linda-r-olsson,10,"Linda R. Olsson, Inc., Realtor is a locally owned real estate firm specializing in Palm Beach Luxury Properties for over 30 years. Recognized by the Wall Street Journal as one of 'America's Best Real Estate Agents,' the company is known for its professionalism, superior service, and unrivaled website. The firm represents buyers and sellers of Palm Beach's finest residences, offering in-depth market knowledge, expert negotiation skills, and global internet exposure on over 300 highly visible websites.",TRUE
FRAME Residential,frame-residential,10,"FRAME Residential is a real estate company based in Massachusetts. It offers services such as buying and selling homes, providing home value assessments, and offering market reports. The company is led by Matthew Petty and provides tools like MyPortal for clients to save properties, receive new listing alerts, view comparables, and access monthly market reports.",TRUE
Northeast Development & Investment,northeast-development-investment,10,"Northeast Development & Investment, Inc. is a commercial real estate company based in Boston, MA. The company is involved in various real estate activities, including office information, real estate agents, and office listings. It has an office located at 715 Boylston Avenue, Boston, MA 02116, and can be contacted at (508) 845-7999. The company also has a team of agents including Anthony Rich, Andrew Haddad, Joe Karam, and Megann Schiffer.",TRUE
Veerman Asset Management,veerman-asset-management,10,"Veerman Asset Management, LLC specializes in the financial management of multifamily real estate assets in the Greater-New Jersey area. The company advises professional real estate owners on their purchases, financing, leasing, as well as planning for taxes and future dispositions or interest-transfers. They help owners create efficiencies in their operations to create better returns and time management. Veerman Asset Management leverages its relationships with highly-accredited vendors and advisors to provide comprehensive asset management services. The firm's unique educational background and professional approach to investment real estate allow for a precise financial overview of multifamily portfolios and advise on options to maximize asset value and future goals. The company is active throughout a client's entire ownership period, not just when it is time to buy and sell.",TRUE
Malman Commercial Real Estate,malman-commercial-real-estate,10,"Malman Commercial Real Estate is a commercial real estate brokerage firm based in Denver, Colorado. The company, founded by Jake Malman, provides premier brokerage services to buyers, sellers, landlords, and tenants. It focuses on investment sales opportunities through buyer/seller representation and offers a high-quality experience for its clients. The firm is involved in various commercial real estate transactions, including sales, leases, and financings, across different asset types and classes.",TRUE
Two Trees Management Company,two-trees-management-company,9,"Two Trees Management is a Brooklyn-based, family-owned real estate development firm founded in 1968. The company owns, develops, and manages residential, commercial, and retail properties across Brooklyn and Manhattan. Notable projects include transforming the Brooklyn neighborhood of DUMBO from an underutilized industrial waterfront to a thriving mixed-use community, as well as developments like 325 Kent, 300 Ashland, Mercedes House, Wythe Hotel, Janes Carousel, and the Domino Sugar Factory site. Two Trees is committed to creating neighborhoods with unique cultural identities and supports businesses that add value to the long-term vitality of the communities.",TRUE
Inc.,inc,9,"NAI Global is a global commercial real estate brokerage firm focused on buying, leasing, selling, financing, and managing commercial property. It has a worldwide reach with offices strategically located across the globe, providing local leadership and informed expertise. The company specializes in various commercial real estate transactions, including office, industrial, retail, land, and hospitality properties. NAI Global is known for its top-tier reputation, time-tested results, and agile operations, making it a uniquely effective global commercial real estate firm.",TRUE
Mgs Group Real Estate,mgs-group-real-estate,9,"MGS Group Real Estate is a boutique residential brokerage firm committed to thoughtfully and strategically helping clients achieve their real estate goals. The company specializes in high-end property transactions, offering personalized and strategic marketing plans. With a focus on relationship-centered service, MGS Group agents prioritize understanding client needs and desires to ensure a seamless real estate experience. The firm operates in multiple locations, including Boston, Greater Boston, New York City, and Miami, and has a team of experienced agents with a combined sales volume exceeding $4.5 billion.",TRUE
Access Real Estate,access-real-estate,9,"Access Real Estate is a commercial real estate company that invests in and manages a diverse portfolio of iconic hotels, commercial, and residential properties globally. The company focuses on concentrated and opportunistic investments using permanent and scalable capital, allowing it to flexibly invest across various sectors, geographies, and asset types. Key investments include the Faena Hotel in Miami Beach, the Ocean Club in the Bahamas, and multifamily properties through its partnership with Grand Peaks. The company also developed One High Line in West Chelsea, New York, and acquired the Grand-H√¥tel du Cap-Ferrat in France.",TRUE
Core Industrial Realty,core-industrial-realty,9,"Core Industrial Realty provides creative, proven, and comprehensive solutions for investors and consumers of industrial real estate. The company offers a range of services including tenant and landlord representation, acquisition and disposition representation, sale-leaseback advisory, build-to-suit transactions, and investment sales. Core Industrial Realty is committed to delivering superior service through qualitative and quantitative analysis tailored to each project, with a diverse team of experienced professionals dedicated to client satisfaction.",TRUE
Luxuri International Realty,luxuri-international-realty,9,"Luxuri International Real Estate Miami, LLC. is a real estate office specializing in residential and commercial luxury investing. The company is based in North Miami Beach, FL, and is led by experienced agents including Robert Melo, Killian Grondin, Michelle Giler, Morris Esquenazi, and Tyler Woodward. They offer services such as luxury condo sales, re-sales, investment properties, rentals, relocation, and interior design. The company is a member in good standing of the San Juan Board of REALTORS and Miami REALTORS.",TRUE
Urbanize Properties,urbanize-properties,9,"Urbanize Properties is a boutique brokerage firm specializing in engaging with institutional investors and high-net-worth individuals for the purpose of building wealth through sales and acquisitions. The company focuses on capturing desirable and in-demand off-market assets in South Florida and emerging urban-core neighborhoods. Urbanize Properties emphasizes excellence, commitment to clients, reliability, integrity, and diligence in its operations. The firm provides professional, informative, loyal, and dedicated service to its clients, prioritizing their best interests in each transaction to develop long-term customer relationships.",TRUE
Cawley Chicago,cawley-chicago,9,"Cawley Chicago is suburban Chicago's dominant submarket specialist in commercial real estate, specializing in leasing, sales, investment disposition/acquisition, consulting, and asset/property management. Founded in 1998, the company has completed transactions totaling over $1 billion. It provides full-service brokerage and property management services to small/mid-sized companies throughout Chicago and the Greater Midwest.",TRUE
Helmsley Spear,helmsley-spear,9,"Helmsley Spear is America's oldest continuously operating real estate company, founded in 1866 as L.B. Goodale. The company has undergone three ownership changes and was renamed Helmsley Spear after Harry Helmsley's involvement. In 2007, an investment group led by Kent M. Swig purchased the firm, rebranding and redeveloping its operations. Helmsley Spear provides commercial leasing, investment sales, and property management services, leveraging its extensive experience and market knowledge to serve clients effectively.",TRUE
Realty 7,realty-7,9,"Realty 7 is the largest Korean-American real estate company in the Eastern US, serving New Jersey and New York. With over 130 agents, it specializes in residential and commercial real estate services.",TRUE
Rhino Realty Group,rhino-realty-group,9,"Rhino Realty Group Inc. is a full-service commercial real estate company specializing in tenant and landlord representation. The company provides services such as site selection, tenant representation, and landlord representation to various clients including large national retailers and small manufacturing companies.",TRUE
Eastwood Capital Properties,eastwood-capital-properties,9,"Eastwood Capital Properties is a commercial real estate company involved in recent transactions and networking opportunities. The company is represented by brokers like Avi Ben-Ishay, who has closed significant deals, including a $219 million transaction across nine deals. The company focuses on commercial real estate transactions and provides a platform for networking and learning about the players involved in the industry.",TRUE
Odyssey Retail Advisors,odyssey-retail-advisors,9,"Odyssey Retail Advisors is a leading retail real estate advisory firm dedicated to redefining the landscape of luxury retail real estate consultancy through a seamless union of creativity and strategic insight. The company was born from a deep-rooted appreciation for fashion and aims to elevate the retail real estate journey by leveraging in-house expertise, integrity, and a disruptive mindset. It provides comprehensive services including strategic planning, market expertise, site selection, financial evaluation, lease negotiation, and portfolio maintenance. The firm represents premier global retailers, major developers, and landlords, fostering enduring relationships and delivering results with unwavering integrity.",TRUE
J.P. Morgan Asset Management,j-p-morgan-asset-management,9,"J.P. Morgan Asset Management is a global leader in real estate investing with over 50 years of experience. It provides sophisticated investors with a global platform driven by local investment strategies. The company offers a broad array of real estate solutions for clients seeking income, total return, and diversification potential. It owns and manages assets across every major geography and sector, leveraging extensive knowledge and specialized expertise from its dedicated real estate professionals. The firm's Strategic Investment Advisory Group explores how portfolios can take advantage of both public and private real estate, providing unparalleled insights and comprehensive risk management. J.P. Morgan Asset Management has $3 trillion in assets under management and employs over 200 real estate professionals globally.",TRUE
Stonegate Real Estate,stonegate-real-estate,9,"Stonegate Real Estate is a premier full-service real estate provider offering commercial and residential acquisitions, leasing, property management, and value add-brokerage across multiple asset classes. The company's principals bring over a decade of experience and close to a billion dollars in transaction history. They maintain strong relationships with institutional and private firms in the industry.",TRUE
CLS | CRE,cls-cre,9,"CLS CRE is a commercial mortgage brokerage firm specializing in tailored commercial mortgage solutions. They offer expert financial analysis and guidance, competitive loan negotiations, and a streamlined application and approval process. The company represents clients' interests to secure the best possible financing terms and has a nationwide network of capital sources including banks, debt funds, and private equity firms. They also facilitate 1031-exchanges and provide personalized support from start to finish.",TRUE
Commercial Brokers International,commercial-brokers-international,9,"Commercial Brokers International is a full-service commercial brokerage company established in 2006 by Joe Killinger and George Pino. The company focuses on setting a high standard for service by prioritizing clients' best interests. It provides comprehensive services in various types of commercial real estate, including multi-family, retail, land, office, industrial, and hospitality properties. The company also operates within a commercial real estate affiliate network, offering globally accessible services. Additionally, it supports socially responsible investing and philanthropy, emphasizing strong business relationships and community ties.",TRUE
Moody Rambin,moody-rambin,9,"Established in 1969, Moody Rambin specializes in providing project leasing, tenant representation, disposition, development, consulting, and management services to owners and tenants throughout the Texas region and the United States. As Houston‚Äôs largest locally owned, full-service commercial real estate brokerage and management firm, they believe that business is built on relationships. That‚Äôs why honesty and integrity are at the heart of everything they do. With more than 100 team members, they are large enough to satisfy the most demanding of their large institutional clients, yet small enough to deliver personalized service from their principals.",TRUE
Trustpoint Realty,trustpoint-realty,9,"Trust Point Realty is a premier real estate company specializing in Florida's property market. It offers local market insights, property management, and investment opportunities. The company is led by industry expert Joseph and provides a service-centric experience with a focus on superior market insight and dedicated property management.",TRUE
SquareFoot,squarefoot,9,"SquareFoot is a commercial real estate company specializing in helping companies find their next office. Founded in 2011, the company focuses on providing a seamless experience through easy-to-use technology and a highly responsive team. They cater to companies seeking flexible lease options and a stress-free leasing process with transparency throughout. The company operates primarily in the New York City area and uses technologies such as JavaScript, Python, Ruby, SQL, and Swift.",TRUE
Florida Realty of Miami,florida-realty-of-miami,8,Florida Realty of Miami is the state of Florida's largest 100% commission real estate agency. It is the second largest brokerage in Miami-Dade with over 1700 realtors and is ranked as one of the top 10 real estate agencies in the state of Florida and one of the top 75 nationally annually. The company offers 100% commission to its realtors and has been recognized by the National Association of Realtors as one of Florida's top producers in sales.,TRUE
Fort Realty,fort-realty,8,"Fort Real Estate Company, LLC is not mentioned in the provided sources. However, based on the available information, it seems to specialize in residential real estate and listings in Fort Atkinson, WI, and Milwaukee, WI. It does not appear to be a commercial real estate company.",TRUE
