Title,Slug,Deal Count,About,QA
Meridian Capital Group,meridian-capital-group,1540,"Founded in 1991, Meridian Capital Group is America's most active dealmaker and one of the nation's leading commercial real estate finance, investment sales, and retail leasing advisors. The company represents many of the world's leading real estate investors and developers and has specialized practices for a broad array of property types including office, retail, multifamily, hotel, mixed-use, industrial, and healthcare and senior housing properties. Meridian is headquartered in New York City with offices in New Jersey, Maryland, Illinois, Ohio, Florida, and California.",TRUE
Keller Williams Realty,keller-williams-realty,1274,"Keller Williams Realty is an American technology and international real estate franchise with headquarters in Austin, Texas. It is the largest real estate franchise in the United States by sales volume as of 2022. Founded in 1983 by Gary Keller and Joe Williams, it has grown to approximately 1,100 offices and over 200,000 associates worldwide. The company offers various divisions, including Luxury Homes by Keller Williams and KW Commercial, which provide specialized services in luxury and commercial real estate. Keller Williams has expanded internationally, with franchises in multiple countries, and has positioned itself as a technology company with innovative tools and platforms like KW Labs and Kelle, an artificial intelligence app. The company emphasizes a culture built on shared values and a mission to build careers worth having, businesses worth owning, and lives worth living.",TRUE
J.P. Morgan Chase,j-p-morgan-chase,175,"JPMorgan Chase is a multinational banking and financial services company that offers a wide range of commercial real estate financing options. The company provides loans for various property types, including multifamily, office, retail, industrial, and mixed-use properties. JPMorgan Chase offers fixed- and adjustable-rate loan programs with up to 30-year amortization and flexible payment terms. The firm also provides specialized financing solutions through its Private Bank and Agency Lending teams, catering to both small businesses and large corporations. The company's commercial real estate services include customized financing, payments solutions, and treasury services designed to optimize cash flow and streamline operations.",TRUE
Official,official,166,"Official is a global real estate brand specializing in luxury properties. Founded by top-producing sales teams, it operates in markets such as New York, Miami, the Hamptons, and Aspen. The company is known for its data-driven approach to valuation, performance-driven marketing, and access to private and off-market opportunities. Official's leadership team has guided over $42 billion in new development assets worldwide, providing specialized research and real-time market insights to high net worth clients and developers.",TRUE
Partners Real Estate,partners-real-estate,140,"Partners Real Estate is a national commercial real estate firm offering a full spectrum of services and investments. The company provides occupiers and tenants services, landlords and investors services, and specializes in commercial real estate investments. It focuses on delivering superior results through internal collaboration and utilizes industry expertise and local market knowledge to serve clients effectively.",TRUE
Carolwood Estates,carolwood-estates,137,"Carolwood Estates is a boutique brokerage based in Beverly Hills, founded by an organic collaboration of highly successful real estate professionals. Leveraging its stellar leadership and supported by the most refined resources in the industry, Carolwood Estates is driven by an unrelenting focus on discretion, transactional excellence, and exceeding client expectations.",TRUE
NNN Pro Group,nnn-pro-group,78,"NNN Pro Group is a leading commercial real estate investment sales and advisory firm specializing in single-tenant, net lease investment services. The company was founded over 20 years ago by Glen Kunofsky and has since closed over $30 billion in net lease transactions across retail, industrial, and office properties. NNN Pro Group is known for its personal approach, long-term client relations, and strategic business opportunities. The firm offers various services including investment sales, buy-side representation, sale leaseback, 1031 exchange, portfolio management, and finance and refinancing. NNN Pro Group is headquartered in New York City and has been recognized as one of the Best Places to Work in commercial real estate.",TRUE
Madison Realty Capital,madison-realty-capital-2,76,"Madison Realty Capital is a vertically integrated private equity firm focused on US-based commercial real estate private credit strategies. As of June 30, 2024, the firm, including its controlled affiliates, manages $21 billion in assets under management on behalf of a global institutional investor base. Since 2004, Madison has completed over $48 billion of securities and non-securities real estate transactions largely through direct lending to a wide range of borrowers, acquiring non-performing loans, and making preferred equity investments. The firm seeks to deliver value across every phase of the property lifecycle by providing customized financing solutions and strong underwriting capabilities that meet borrowers' unique needs with speed and certainty of execution.",TRUE
Partners CRE,partners-cre,75,"Partners CRE is a National investment real estate advisory and brokerage firm, based in Beverly Hills, specializing in the sale of income-producing properties. The company provides a full suite of integrated real estate services, tailored to deliver quantifiable value to clients ranging from investors, owners, and developers, to tenants across a range of industries. Their multidisciplinary team has a demonstrated track record of uncovering promising opportunities and navigating complex real estate transactions with expertise and integrity.",TRUE
NewQuest Properties,newquest-properties,73,"NewQuest Properties is a privately owned, full-service company founded in 2001. It specializes in retail leasing, tenant representation, land brokerage, commercial development, and property management. The company is headquartered in Houston, Texas, and manages a $2.3 billion portfolio encompassing more than 100 retail and mixed-use projects across Texas, Louisiana, Arizona, and Georgia. NewQuest Properties has over 20 years of experience in commercial real estate and is known for its focus on delivering consistent, predictable results with every project.",TRUE
MIG Realty,mig-realty,72,"MIG Real Estate LLC is a privately held real estate investment and development firm headquartered in Newport Beach, California. The company invests in and develops high-quality multifamily, hotel, retail, and industrial/flex properties located in the Western U.S. and Sunbelt states. MIG Real Estate owns and operates over 10 million square feet of retail, office, and industrial/flex uses, more than 1,740 hotel keys, and over 6,800 multifamily units. The company focuses on strategic investment and management of sustainable residential and business communities with a focus on retaining full ownership of its real estate investment assets for value-add appreciation.",TRUE
Christian Angle Real Estate,christian-angle-real-estate,68,"Christian Angle Real Estate is a boutique-style real estate brokerage firm specializing in luxury residences and commercial properties in Palm Beach and South Florida. Founded by Christian Angle over 20 years ago, the company has built a reputation for delivering results through extensive real estate knowledge, aggressive marketing campaigns, and successful negotiation skills. The firm has achieved national recognition, ranking among the top 250 real estate professionals for sales volume, as referenced in the Real Trends/Wall Street Journal. Christian Angle Real Estate has sold over $1.5 billion in real estate since 2020 and has been ranked #1 in Palm Beach with over $790 million sold in 2022, according to Real Trends/The Wall Street Journal.",TRUE
Berger Commercial Realty,berger-commercial-realty,63,"Berger Commercial Realty is a full-service commercial real estate firm based in Boynton Beach, Florida. The company provides a range of services including commercial property management, leasing, brokerage, and construction management. With a portfolio of over 7 million square feet, Berger Commercial Realty is one of South Florida's leading property management firms, offering strategic management plans tailored to each client's unique needs.",TRUE
Atlantic Retail,atlantic-retail-,61,"Atlantic Retail is a Boston-based, full-service brokerage and advisory firm with nine locations along the East Coast and Southern California. It provides services including tenant representation, property leasing, portfolio disposition, land management, high street & urban, and capital markets. The company represents over 250 retail clients of all sizes and offers advisory services to a breadth of property owners from large institutional investors, family offices, and merchant developers.",TRUE
Block Real Estate Group,block-real-estate-group,60,Block Real Estate Group is a New York City based real estate brokerage and advisory firm that specializes in the sale of investment properties and multifamily townhomes in New York City.,TRUE
NAI James E. Hanson,nai-james-e-hanson-,57,"NAI James E. Hanson is a full-service commercial real estate firm committed to providing the highest quality commercial real estate services in Northern New Jersey and Southern New York. Founded in 1955, the company focuses on two clear objectives: performing extraordinary work and delivering remarkable client service. Their services include property management, lease abstracting and administration, tenant installation, and cash management, among others. The company has received numerous awards and recognitions for its achievements in the industry.",TRUE
Northgate Real Estate Group,northgate-real-estate-group,55,"Northgate Real Estate Group specializes in bankruptcy, foreclosure, loan sales, workouts, REOs, and special situation sales. The company offers a full spectrum of services for real estate borrowers and lenders, including Chapter 11 recapitalization, Chapter 7 363 liquidation, judicial or UCC foreclosure, loan sale, and lender/borrower workout. With over $3,300,000,000 in transactions, Northgate's team is well-versed in all aspects of special situation sales, refinancing, and recapitalizing assets. The company maintains a deep understanding of the complex legal structures, documents, and strategies involved in bankruptcy and foreclosure. Northgate's extensive proprietary database of over 70,000 people includes real estate investors, developers, institutional funds, syndicators, attorneys, trustees, family offices, auction participants, brokers, and buyers specializing in distressed properties, loans, and troubled assets.",TRUE
Grove Property Group,grove-property-group,52,"Grove Property Group specializes in off-market multifamily investment properties, leasing, property management, and residential sales. Founded in 2023, the company emerged from a collective vision to revolutionize the real estate industry with a focus on integrity and expertise. Despite being a young company, the team boasts decades of combined experience in the field. Grove Property Group leverages extensive market knowledge and innovative strategies to provide tailored solutions for each client's unique needs. The company is committed to honesty, integrity, and transparency, ensuring that clients receive trustworthy guidance throughout their real estate journey.",TRUE
MOD,mod,51,"MOD specializes in creating tailored growth plans for retailers. From multinational giants to direct-to-consumer startups and local restaurants, they help businesses find ideal spaces. They offer tenant representation services, ensuring that each business finds the optimal space for its needs. Additionally, they provide landlord representation, working closely with architects, marketing departments, banks, and lenders to maximize the value of properties. MOD aims to shape the NYC landscape by connecting outstanding brands with great spaces, adding value beyond financial returns.",TRUE
FA Commercial,fa-commercial,51,"FA Commercial is a top commercial real estate brokerage in South Florida, specializing in the disposition, acquisition, and leasing of commercial properties within Miami's top districts. The company offers advanced transactional services for real estate developers, landlords, institutional investors, and tenants, with a track record of over $1 billion in transactional volume across all asset types from 2013 to 2024.",TRUE
Bank Hapoalim (BHI),bank-hapoalim-bhi-,49,"Bank Hapoalim International (BHI) is the U.S division of Bank Hapoalim, Israel's leading financial institution. It provides commercial banking solutions to middle market clients in various sectors including commercial real estate, general and domestic C&I, private equity, food and beverage, apparel, healthcare, corporate banking, and high-tech. BHI operates U.S. Representative Offices in New York, Woodcliff Lake, New Jersey, Miami, Florida, and Los Angeles, California. The bank specializes in financing opportunities for prudent and accomplished developers, focusing on sectors with strong underlying secular trends.",TRUE
Galaxy Capital,galaxy-capital,46,"Galaxy Capital is a private equity debt solution and advisory firm specializing in the entire real estate capital cycle, including acquisition, bridge, construction, refinance, recapitalization, private, and preferred equity. The company provides flexible solutions that are efficient and economical for transaction cycles, delivering the full capital stack with certainty of execution to meet short and long-term goals.",TRUE
Realty Executives,realty-executives-,46,"Realty Executives is a real estate company that specializes in both residential and commercial properties. The company offers a range of services including property listings, market analysis, and expert advice from experienced real estate agents. Realty Executives has a global presence with local offices and agents who are equipped to handle various types of real estate transactions. The company emphasizes education and expertise, providing comprehensive support throughout the buying or selling process.",TRUE
Convoy Capital,convoy-capital,45,"Convoy Capital is a commercial loan advisory firm specializing in helping clients and lenders achieve their financing goals. The company provides customized loan solutions for multifamily, commercial, and net leased properties. It leverages key relationships with lender institutions to offer the best loan programs for clients' needs. The firm offers a streamlined loan application process and reliable closings through its dedicated Concierge team of financial guides.",TRUE
Fortune Capital Group,fortune-capital-group,44,"Fortune Capital Group is a CRE Debt Advisory Firm with experience in all asset classes including multifamily, retail, industrial, office, and special-use properties. Founded by Jake Gluck, the firm has been involved in over $3B in transactions over the 5 years since inception. The company emphasizes full transparency with lenders and clients, hard work, and dedication to ensure deal closure. They have relationships with top-tier CMBS, Agency, and local bank lenders across the country.",TRUE
Mann Capital Advisors,mann-capital-advisors,43,"Mann Capital Advisors is a commercial real estate advisory firm with a transaction volume of $268 Million across 43 deals. The company is led by Abe Mann, who has a proven track record in real estate transactions.",FALSE
Oxford Partners,oxford-partners,39,"Oxford Partners is a commercial real estate company established in 1997, specializing in tenant representation for office and industrial users. The firm provides brokerage services, including commercial leasing, property purchase or sale, and strategy development. They assist clients with renewing leases, relocating, expanding, and managing multiple locations. Oxford Partners is based in Houston, TX, and has been serving clients for over 20 years.",TRUE
SP Capital Group,sp-capital-group,38,"SP Capital Group LLC is a real estate investment sales advisory firm based in New York, New York. The company provides services related to commercial real estate transactions and is located at 226 W 37th St, Suite 601, New York, NY 10018. It has 15 employees and has not received any funding rounds.",TRUE
MSP Group,msp-group,38,"MSP Group is a commercial real estate company founded in 2015 with the mission of being the most trusted name in South Florida commercial real estate. The company is committed to integrity, service, and results. It was founded by Deme Mekras, who has extensive experience in the multifamily arena, having closed nearly 12,000 units and $1 billion in transactions. The team includes Sam Mekras, a senior investment associate with over 10 years of experience and nearly $600 million in transaction experience. MSP Group emphasizes quality over quantity and provides best-in-class service, expert analysis, and robust access to the market. The company has closed significant deals in South Florida, including apartments and retail properties.",TRUE
Filler Capital,filler-capital,37,"Filler Capital is a boutique partner for commercial real estate and multifamily financing. It specializes in various loan executions including Bridge, Construction, CMBS, Agency, Balance Sheet, CLO, Mezz, and preferred Equity structures. The company prioritizes client relationships and aims to make the financing process smooth while securing the best terms for its clients.",TRUE
Brown Commercial Group,brown-commercial-group,36,"Brown Commercial Group is a boutique, full-service commercial real estate firm specializing in the marketing, disposition, and acquisition of industrial, office, and investment-grade real estate in the Chicago metropolitan area. The firm offers comprehensive property sale and leasing services, buyer and tenant representation, lease renewal and renegotiation, and investment solutions. With over 150 years of combined experience, Brown Commercial Group has built long-lasting relationships with established buyers, tenants, and investors, leveraging its market knowledge and established relationships to secure favorable results for clients.",TRUE
Baseline Real Estate Advisors,baseline-real-estate-advisors,33,"Baseline Real Estate Advisors is a licensed New York-based, client-first, commercial real estate brokerage specializing in investment sales. The company prioritizes honesty, transparency, and integrity, making the sales process straightforward and smooth for clients. Founded by Michael Sherman, who has completed over $400 million in transactions during his decade-long experience in the industry. His work has been featured in publications such as The New York Times, The Real Deal, Commercial Observer, and Crain's. Mr. Sherman graduated with a BA in economics from Bates College and has a background in coaching at a premier tennis academy in Spain.",TRUE
Landair Property Advisors,landair-property-advisors,33,"Landair Property Advisors is a commercial real estate brokerage specializing in complex transactions, particularly in development sites. The company is based in New York City and utilizes its knowledge of NYC zoning laws, financial, construction, and market data to evaluate and market development sites. The team includes partners and senior associates with extensive experience in real estate transactions, including sourcing and closing significant deals. Landair Property Advisors is known for its strategic marketing, client-focused approach, and dedication to ensuring smooth and efficient transactions.",TRUE
Baldwin Pearson & Co,baldwin-pearson-co,33,"Baldwin Pearson & Company, Inc. is a family-owned commercial real estate firm located in Bridgeport, CT. The company has been in operation for over 70 years and provides services including commercial real estate sales, appraisals, and leasing. They serve the Greater Fairfield area and have an extensive database of local and national buyers.",TRUE
Base Realty Group,base-realty-group,31,"{'name': 'BASE Realty Group', 'location': 'New York', 'founders': ['Jonathan Brody', 'Michael Schattner'], 'services': ['Real Estate Advisory', 'Transaction Management', 'Client Strategy and Consulting', 'Equity and Debt Management', '1031 Exchange Expertise'], 'focus': ['Multifamily', 'Industrial', 'Development Investment Sales'], 'experience': ['Over 15 years of real estate sales and investment experience', ""Jonathan Brody: $2 billion in multifamily transactions, former president of Rosewood Realty Group's National Investment Sales division"", 'Michael Schattner: $800 million in transaction volume, former vice president of investment sales at Rosewood Realty Group'], 'mission': ['Provide informed valuations and pricing recommendations', ""Develop customized strategies tailored to clients' specific needs"", 'Build lasting relationships with clients']}",FALSE
We Lend,we-lend,30,"We Lend LLC is a private real estate lending company that offers fast, flexible loans with quick closings and no upfront fees. The company provides tailored solutions for bridge, DSCR, and rental property loans. It operates nationwide, with a focus on origination growth, investor security, and capital preservation. We Lend is known for its broker-friendly services, low starting rates, and a flexible acceptance process. The company aims to simplify the real estate lending process, making it accessible to both first-time and experienced borrowers.",TRUE
Bank of Montreal (BOM),bank-of-montreal-bom,30,"Bank of Montreal (BMO) is a Canadian multinational bank and financial services company. It is one of the largest banks in Canada and has significant exposure to the US commercial real estate market. BMO provides a range of financial services including commercial real estate banking, treasury management, and investment banking products. The bank is headquartered in Montreal, Quebec, and has a major presence in the Midwest through its US operations. BMO is known for its commitment to delivering insights and services tailored to the needs of various real estate clients, from middle market development firms to REITs and private equity funds. The bank has been actively involved in major real estate projects, such as the construction of BMO Tower in Chicago, which serves as its US headquarters.",TRUE
Weber Frank Real Estate,weber-frank-real-estate,30,,FALSE
The Brokerage South Florida Real Estate,the-brokerage-south-florida-real-estate,30,"The Brokerage South Florida Real Estate, LLC. is a real estate office based in North Miami, FL. It has 23 active property listings and 40 sold property listings. The office is located at 9431 Harding Ave, Surfside, FL 33154, and its main phone number is (786) 509-6846.",FALSE
Artemis Realty Advisors,artemis-realty-advisors,29,"Artemis Realty Advisors is a commercial real estate company that offers an integrated approach to real estate. Their team of 'Designer Agents' has a background in design and construction, providing a global approach to finding, building, or marketing properties. They integrate digital search and purchasing processes to help clients visualize the steps required to reach their goals. The company is known for its expert negotiating skills and ability to guide clients through the clutter of the market, helping them envision possibilities and achieve the best return on investment.",TRUE
CORFAC International,corfac-international,29,"CORFAC International is a global network of privately held entrepreneurial commercial real estate firms. Founded in 1989, it offers services in office, industrial, and retail brokerage, tenant and landlord representation, investment sales, multifamily, self-storage, acquisitions and dispositions, property management, and corporate services. The network has 70 offices in the U.S., Canada, and international markets, including Australia, Costa Rica, France, Germany, India, Ireland, Italy, Japan, Netherlands, Philippines, Poland, Romania, Russia, South Korea, Switzerland, and the United Kingdom. CORFAC International has completed over 10,000 lease and sales transactions totaling approximately 400 million square feet of space valued in excess of $7.4 billion as of 2014.",TRUE
Unknown Correspondent life insurance company,unknown-correspondent-life-insurance-company,27,"An unknown correspondent life insurance company is typically a commercial mortgage company that has the exclusive right to make commercial loans in a given region for a particular life company. They handle site inspections, collect payments, and handle any foreclosures on behalf of the life insurance company. The correspondent does not have a publicly available website and is often hired by life insurance companies to service their loans locally. They are known for offering competitive interest rates and terms, particularly for large commercial permanent loans secured by properties such as multifamily, office, retail, or industrial buildings located in primary locations.",TRUE
