Title,Slug,Deal Count,About,QA
Priority Capital Advisory,priority-capital-advisory,16,"Priority Capital Advisory is a premier boutique debt and equity capital advisor for middle and upper middle market commercial real estate sponsors. The company arranges highly structured and innovative finance solutions, focusing on transactions with a total capitalization of $30 million to $200 million. With a combined 40 years of commercial real estate experience, the team provides exceptional service and expertise in curating solutions for clients' capitalization journeys. Priority Capital Advisory has a proven track record, having closed over $5 billion in transactions, worked with over 500 capital providers, and managed over 10,000 multifamily units and hotel keys.",TRUE
Marshall Real Estate,marshall-real-estate,16,"Marshall Real Estate is a boutique commercial real estate investment agency with over 15 years of experience in the industry. The company specializes in the purchase and sale of commercial real estate in Central London and the UK, with over ¬£1bn of transactional experience. They assist clients globally in buying and selling commercial investment and development properties, focusing on tailored, personal service, institutional rigor, niche efficiency, results and solution focus, and repeat business.",TRUE
Vertical Real Estate,vertical-real-estate,15,"Vertical Real Estate is a boutique real estate company based in Miami, FL, focused on cutting-edge food & beverage brands and aspirational retail. The company is committed to shaping Miami's most iconic neighborhoods through integrated urbanization projects and neighborhood-shaping initiatives.",TRUE
Goodwin & Associates Real Estate,goodwin-associates-real-estate,15,"Goodwin & Associates Real Estate, LLC is a real estate brokerage company founded in 1996 by Mark Goodwin, a University of Illinois graduate and vocational agriculture teacher. The company specializes in the sale of farm, commercial, development, and residential land in the northern two-thirds of Illinois, including the collar counties of Chicago. The firm provides a range of services including entitlement and approval services, valuation services, marketing network, farm management, consulting, institutional special assets representation, site selection, portfolio disposition, and auction services. The company is known for its extensive experience in land sales and its ability to assist clients with 1031 tax exchanges, which can save clients hundreds of thousands of tax dollars. Goodwin & Associates Real Estate, LLC is accredited with the Accredited Land Consultant (ALC) award and is a member of Rotary International and the REALTORS¬Æ Land Institute (RLI).",TRUE
Hannah Howard Advisory,hannah-howard-advisory,15,"Hannah Howard Advisory is a commercial real estate brokerage firm specializing in investment sales and financing, particularly for multifamily properties in the sunbelt. The company is led by Hannah Howard, who has sold and financed over $1 billion in real estate transactions. The firm offers services including long-standing lender relationships, market intelligence, and customer service.",TRUE
The Mega Group,the-mega-group,15,"The Mega Group, based in Danvers, MA, has been providing commercial real estate brokerage services since 1997. The company specializes in investment and commercial sales, hotels and hospitality investments, retail and industrial leasing, real estate development, and retail property management. Their services cover the greater metropolitan Boston area, the seacoast of New Hampshire, and southern Maine. The company offers a wide range of services including retail properties, hospitality investments, business brokerage services, and 1031 tax deferred exchanges.",TRUE
BM2 Realty,bm2-realty,15,"BM2 Realty is a commercial real estate company based in Aventura, Florida, with over 20 years of experience in the field. The company provides fully integrated services, including property management, investment opportunities, and assistance with transactions. They specialize in identifying client requests, recommending the best opportunities, preparing contracts, and cooperating with inspections and due diligence. Additionally, they offer conventional and private lending options with fast closing times.",TRUE
Gemstone Realty Group,gemstone-realty-group,15,"Gemstone Realty Group is a premier property management and real estate company dedicated to delivering unparalleled management services for your properties. They offer comprehensive market analysis, rigorous tenant screening, prompt rent collection, and detailed financial reporting tools. The company is committed to providing exceptional service, professionalism, and peace of mind to its clients, with a focus on transparency, reliability, and community service.",TRUE
H2C Securities,h2c-securities,15,"H2C Securities Inc. is a subsidiary of Hammond Hanlon Camp LLC (H2C), an independent strategic advisory and investment banking firm specializing in healthcare mergers and acquisitions, capital markets, and real estate transactions. H2C Securities offers securities through its wholly owned subsidiary and is a member of FINRA/SIPC. The firm provides advisory services to healthcare organizations and related companies, with a focus on not-for-profit sectors. It has a long track record of success in various transactions representing billions of dollars in value.",TRUE
Castellan Capital,castellan-capital,15,"Castellan Capital is a privately held direct portfolio lender that provides bridge loans. It specializes in time-sensitive situations where conventional real estate financing is not available. The company offers fast, flexible, and reliable commercial real estate financing nationwide with discretionary balance sheet funding.",TRUE
Equity Lending Solutions,equity-lending-solutions,15,"Equity Lending Solutions is a direct private/hard money lending company specializing in various types of investment properties throughout Florida. They focus on tailoring loans to each specific borrower type, emphasizing transparency and no surprises at the closing table. Their services include quick approval processes, easy and friendly underwriting, no prepayment penalties, and record-time closings. They offer online notarization for remote closings and cater to foreign nationals. The company provides flexible loan options for fix and flip, ground-up construction, bridge loans, and DSCR loans. They prioritize building strong, lasting relationships with their clients to drive the growth of their real estate investments.",TRUE
Insight Realty Group,insight-realty-group,14,"Insight Realty Group is a real estate company based in Greater Boston, with offices in West Roxbury and Hyde Park. It is the #1 market leader in Roslindale, West Roxbury, and Hyde Park. The company has over 50 years of combined experience in the Greater Boston real estate market and offers innovative marketing plans to maximize all channels of marketing, leveraging tools from top real estate companies to achieve results.",TRUE
American Street Capital,american-street-capital,14,"American Street Capital (ASC) is a Chicago-based national commercial mortgage banking firm with correspondent lending relationships, specializing in the acquisition, reposition, disposition, and financing of commercial real estate. The company was founded by Igor Zhizhin and has over 20 years of experience in the industry. ASC has successfully executed numerous transactions across various regions, including Palm Beach County, FL, Alsip, IL, Jonesboro, GA, and Burbank, IL. The firm is led by experienced professionals such as James R. Bogard (Principal & Chief Credit Officer), Alexander F. Rek (Principal & Director of Operations), and Tom Krouse (Account Executive).",TRUE
Athene,athene,14,"Athene Holding Ltd. is a leading retirement services company that issues, reinsures, and acquires retirement savings products. It provides various annuity options, including fixed, indexed, and hybrid annuities, to help individuals build and secure their retirement income. The company is headquartered in West Des Moines, Iowa, and is a subsidiary of Apollo Global Management, Inc. Athene is known for its financial strength and stability, with high ratings from independent rating agencies such as S&P, Fitch, AM Best, and Moody's.",TRUE
KeyBank Real Estate Capital,keybank-real-estate-capital,14,"KeyBank Real Estate Capital is a leading provider of commercial real estate finance, offering a broad range of financing solutions including interim and construction financing, permanent mortgages, commercial real estate loan servicing, investment banking, and cash management services. Headquartered in Cleveland, Ohio, the company provides financing for various types of income-producing commercial real estate, including multifamily properties, affordable housing, seniors housing, and student housing. KeyBank Real Estate Capital is also a Fannie Mae Delegated Underwriter and Servicer, Freddie Mac Program Plus Seller/Servicer, and FHA approved mortgagee. The company is part of KeyCorp, one of the nation's largest bank-based financial services companies with assets of approximately $181.2 billion as of March 31, 2022.",TRUE
Trustone Realty Advisors,trustone-realty-advisors,14,"Trustone Realty Advisors is a leading advisory firm dedicated to providing comprehensive services to clients across various sectors. The company specializes in industrial real estate investments and management, with expertise in investment sales and landlord representation. It operates in markets such as Orlando, South Florida, and Tampa/St Petersburg. The firm's principal, Jake Zebede, has extensive experience in real estate, having represented 14 million square feet of properties in South Florida and worked on over $3 billion in transactions. Trustone Realty Advisors employs a team that includes Joseph Linder and Kevin Gonzalez.",TRUE
Blue Ocean Property Management,blue-ocean-property-management,14,"Blue Ocean Property Management LLC is a real estate company based in Boston, MA. It was incorporated on March 26, 2019, and operates as a Limited Liability Company (LLC). The company is involved in activities related to real estate, including property management, leasing, and appraisals. It has 2 employees and is known for its services in residential and commercial property management.",TRUE
Aho Properties,aho-properties,14,"Aho Properties is a boutique commercial real estate firm founded in 2018 by Joel M. Aho. The firm specializes in tailored brokerage services, including commercial real estate sales, leasing, consulting, and investment sales. Aho Properties is known for its expertise in off-market property acquisition assignments. Joel Aho, a third-generation real estate professional, brings over fourteen years of brokerage experience to the company. He has also worked as a Senior Financial Analyst for BAE Systems and has real estate development experience, including securing permits for a 25,000 SF industrial project in Southborough, MA.",TRUE
Stony Brook & Lennox Realty Advisors,stony-brook-lennox-realty-advisors,14,"Stony Brook & Lennox Realty Advisors is a leading real estate firm in Boston, specializing in high-level services for sellers, investors, buyers, and developers. The firm is led by top-producing real estate broker Markese Daise and is well-versed in the Boston real estate market. They focus on multi-family property sales, investment real estate sales, developer representation, seller representation, investor representation, residential and commercial sales/leasing, traditional home and condo sales, and buyer representation. The company is known for its innovative strategies and high-value outcomes in today's real estate market.",TRUE
SL Green Realty,sl-green-realty,14,"SL Green Realty Corp. is a fully integrated real estate investment trust (REIT) primarily focused on acquiring, managing, and maximizing the value of Manhattan commercial properties. As of September 30, 2024, the company held interests in 55 buildings totaling 31.8 million square feet, including ownership interests in 28.1 million square feet of Manhattan buildings and 2.8 million square feet securing debt and preferred equity investments. The company is Manhattan's largest office landlord and offers services such as property management, development, and leasing.",TRUE
Arborview Realty,arborview-realty,14,"Arborview Realty Inc is a full-service real estate firm specializing in residential real estate, including home buying, selling, and rentals. The company is based in Jamaica Plain, Massachusetts, and has over 31 years of experience in the local market. It is known for its high-level expertise, customer service, and attention to detail. The firm has a team of licensed agents and property managers, including Christian Iantosca, the #1 agent in Jamaica Plain from 2011 to 2023. Arborview Realty manages over 200 rental properties and has a reputation for efficiency and professionalism in both sales and property management.",TRUE
Alfred Sanzari Enterprises,alfred-sanzari-enterprises,14,"Alfred Sanzari Enterprises is a family-owned and operated commercial and residential real estate firm founded in 1945. The company specializes in the development and management of office, industrial, residential, and hospitality assets. It is headquartered in Hackensack, New Jersey, and is known for its commitment to quality and service. The company's operations include construction, leasing, finance, operations, and property management. It has a diverse portfolio of over six million square feet of real estate, with a focus on long-term ownership and responsible development that enhances local communities.",TRUE
HPNY,hpny,13,"Hakimian Properties Inc. (HPNY) is a real estate company based in New York, specializing in commercial real estate services. The company offers a range of services including sales, leases, financings, and construction. HPNY is led by experienced real estate brokers such as Itai Hakimian and Sean Lefkovits.",TRUE
Harvard Real Estate,harvard-real-estate,13,"Harvard Real Estate is committed to supporting Harvard University in building and operating a healthier, more equitable, and more sustainable campus community. It provides real estate services to the Harvard University community, including asset management for commercial spaces and strategic real estate support. The organization also offers a Sustainable Workplace Initiative to help tenants reduce their workplace's footprint and engage in sustainability projects.",TRUE
Crowd Lending,crowd-lending-,13,"Crowd Lending, Inc. is a Boston-based company founded by experienced real estate professionals. It provides borrowers with hassle-free, affordable alternatives to institutionalized lending. The company is a vertically integrated, regional direct hard money lender that sources, underwrites, funds, and services real estate loans throughout the Northeast. Crowd Lending, Inc.'s mission is to bridge the gap between real estate investors and developers by offering a secure and efficient lending platform. The company's core values include integrity, transparency, reliability, and flexibility, with over 40 years of combined real estate experience among its founders.",TRUE
Rooney Real Estate,rooney-real-estate,13,"Rooney Properties, LLC is a privately held real estate development company located in Arlington, Virginia. The company specializes in commercial real estate development in the Washington, DC metro area, focusing on mixed-use, multi-family, and office properties. The team combines diverse backgrounds and skillsets to handle acquisitions, investment management, complex entitlements, development, asset management, and construction management. The company emphasizes safety, excellence, integrity, respect, and a client-driven culture in its operations.",TRUE
The Econic Company,the-econic-company,13,"The Econic Company was founded with a singular goal: to provide a specialized and bespoke retail real estate experience for both landlords and tenants in an ever-changing retail and economic landscape. Our principal and founder, James Chung, is a highly regarded retail broker with 22 years of experience in the commercial real estate industry nationwide.

Born and raised in the Bay Area (and a proud Berkeley graduate!), James has his finger on the pulse of every retail corridor across the region’s nine counties. We represent over 40 million square feet of retail space and work with 200 national and regional tenants, helping them navigate leasing and location strategies across the U.S.

We understand retail down to the square inch, and our commitment to serving clients to the highest standard guides everything we do. Our strong, trusted, and longstanding relationships with owners and occupiers allow us to create unparalleled value for both sides of a transaction.",TRUE
Boston Brokerage Group,boston-brokerage-group,13,"Boston Brokerage Group is a full-service real estate brokerage firm founded on a long tradition of client satisfaction, experience, and market knowledge. The company was established in 2006 and is located in the Fenway area of Boston. It specializes in housing and has completed numerous projects, including a $500 million transit-oriented mixed-use development. Boston Brokerage Group is committed to providing timely and professional services, leveraging advanced technology to meet client needs. The firm is known for its customer service and trust, building on the values of Eurovest Realty, which was founded by Joe DiGangi Sr. in 1975.",TRUE
Cozza Investment Group,cozza-investment-group,13,"Cozza Investment Group is a real estate company based in Fort Myers, Florida, specializing in luxury homes. The company, led by Brad Cozza, has over 20 years of experience and has expanded to the South Florida market, including Miami. With a team of 20 bilingual and diverse agents, Cozza Investment Group offers a seamless real estate experience designed to provide value at every stage. The company is known for its bulk acquisition model and strategic home renovation services. It has been ranked #10 in the nation for volume produced nationwide by the Wall Street Journal and has navigated multiple market cycles successfully.",TRUE
Junction Commercial Real Estate,junction-commercial-real-estate,13,"Junction Commercial Real Estate is a full-service commercial real estate firm specializing in brokerage and investment management. With over thirty years of experience, the company aims to be the preeminent commercial real estate brokerage and investment management company in the USA. The firm offers a range of services including project management, corporate services, and financial management, led by a team of distinguished real estate brokers and development professionals.",TRUE
GAIA Property Group,gaia-property-group,13,"GAIA Property Group is a real estate company specializing in both residential and commercial property development. The company focuses on creating sustainable and versatile environments that enhance life and work. It prioritizes innovation, sustainability, and flexibility in its projects. GAIA Property Group is managed by a dedicated team committed to quality and safety, ensuring each development meets the highest standards. The company is led by Russ and Marie, who drive the business with strong ethics, a pursuit of excellence, and a passion for creating meaningful spaces.",TRUE
Onyx Funding,onyx-funding,13,"Onyx Funding is a national, full-service commercial real estate firm with a focus on financing and loan origination. The company offers diverse expertise, vast lender relationships, and real estate market experience to customize financing solutions for clients. With a strong presence in the industry, Onyx Funding has successfully originated and managed investments for over thirty years, growing from operators with a vision to a professional commercial investment firm with a presence in debt lending, operating, and the MHC market.",TRUE
Greenrock Funding,greenrock-funding,12,"Greenrock Funding LLC specializes in providing various financing options for commercial real estate, including construction loans, note-to-note financing, ground-up construction, hard money, and bridge money. The company scrutinizes each client's situation to identify the best financing options available. Their services cater to diverse clients, ranging from multi-family apartment buildings to office buildings and large-scale commercial properties. The company is based in New York and has been established since 2014.",TRUE
S2 Property Group,s2-property-group,12,"S2 Property Group is a distinguished boutique real estate investment and advisory firm specializing in off-market industrial opportunities. The firm is led by Principal Solomon Michailow, who has transacted on over $500 million in office, industrial, and multi-family transactions.",TRUE
Fairview Property Group,fairview-property-group,12,The website for Fairview Property Group is currently under maintenance. It is not possible to retrieve detailed information about the company from the provided link.,TRUE
Winston Capital Management,winston-capital-management,12,"Winston Capital Management is a hedge fund company based in Arlington, VA. It operates 4 private funds and has approximately $1.22 billion in total assets. The company is a Limited Liability Company (LLC) registered in the United States with SEC number 801-54022. It focuses on fund of funds strategies and manages pooled investments of 51-75 percent. The key executives include Marvin Pierce Bush as President/Director, Jonathan David Scanlon as Director/Vice-President, and William Otto Birchfield as Chief Financial Officer/Chief Operating Officer/Chief Compliance Officer/Treasurer/Secretary/Director.",TRUE
Broad Sound Real Estate,broad-sound-real-estate,12,"Broad Sound Real Estate, LLC specializes in Revere Real Estate and provides services for buying, selling, and renting properties. The company is based in Revere, Massachusetts, and serves the North Shore area, including Winthrop, Lynn, East Boston, Saugus, Chelsea, and East Boston. They assist both first-time home buyers and seasoned real estate investors. The team includes experienced agents such as Nicholas Daher, Matt, Steve, Esteban, Juan Franco, Sebastian Taborda, and Stephen Schultz. The company offers a variety of real estate services, including comparative market analyses and financial analyses for investment properties.",TRUE
Jeffery Realty,jeffery-realty,12,"Jeffery Realty is a 30-year-old successful commercial real estate brokerage firm specializing in the selling and leasing of retail properties in New Jersey. The company has consummated and co-brokered more than 3,500 retail transactions. It focuses on providing the best service to landlords, developers, and retailers by putting their goals and objectives first. Services include leasing, site selection, tenant representation, and investment sales. The firm's involvement is strictly on a retail leasing basis, excluding office and industrial properties. It aims to develop long-term working relationships by helping customers find the right deals.",TRUE
RJBRE,rjbre,11,"RJBRE is a full-service commercial brokerage that specializes in both tenant and landlord representation. With over a decade of experience in commercial leasing, the company aims to deliver exceptional service by providing clients with the information and insights necessary to make informed decisions. Their team possesses expertise in market knowledge, expert negotiation skills, and closing deals. The company's goal is to secure the best possible deals for all parties involved and help pave a path for success.",TRUE
Parkway Properties,parkway-properties,11,"Parkway is a fully diversified real estate investment, operations, and management firm dedicated to transforming communities. It operates in various national markets and offers comprehensive solutions for investors, developers, and financial leaders. The company has over 200 years of executive leadership experience and manages approximately 30 million square feet under its portfolio. Parkway has been recognized for its leasing excellence and is committed to sustainability and accessibility.",TRUE
Biscayne Advisors,biscayne-advisors,11,Biscayne Advisors is a full-service real estate brokerage firm specializing in off-market transactions.,TRUE
Younger Partners,younger-partners,11,"Younger Partners is a full-service boutique commercial real estate firm providing investment, leasing, and management services to investors and tenants in the Dallas/Fort Worth region. The company specializes in the acquisition and disposition of land, multifamily, office, industrial, and retail properties. With a talented team of real estate professionals, Younger Partners aims to deliver lasting value for its clients by identifying opportunities in various types of real estate.",TRUE
Bravo Capital,bravo-capital-,11,"Bravo Capital is a leading privately-held lender with a national footprint, specializing in real estate lending. The company provides a broad array of financing solutions, including HUD, mezzanine, and bridge financing, primarily for multifamily and healthcare properties. It is headquartered in New York City and has overseen billions of dollars in HUD financings. Bravo Capital is known for its deep knowledge of the HUD financing process, thorough underwriting standards, and commitment to transparency and client relationships.",TRUE
